reviewerID,asin,reviewerName,helpful,customer_review,customer_rating,customer_review_summary,unixReviewTime,reviewTime
A2BB6IKKR4G40J,B003FO6E6M,Anthony,"[0, 1]","Sounded good. Warmer sounding than stock tubes in my ac15. I rocked all night and loved the sound. Next day i turned it on, my amp was crackling out and wiping out the signal i checked the tubes and one of them was making violent purple flashes before the signal burnt out. I then noticed that one of my fuses blew out as well. I changed out the fuse and checked again and the tube was still doing the same thing so i just swapped the tubes back for atock. Id like to see a real set of jjs, im sure one of them was a dud.",0.0,Good. But then...,1399766400,"05 11, 2014"
A33PUQETQAM8XT,B003K16N0C,NickT,"[1, 1]","I play harp with some some that I perform. I found that all of these Harmonica's the note's are off and it's hard to play, I have G Blues harp that I compared the G harp to and the notes were a little off. The C harp was terrible. That said the only thing I like about this order is the case. I going to see if I can return them for store credit.",0.0,Notes off Hard to play,1381536000,"10 12, 2013"
A10ZSXTQA264C7,B003KQY8DQ,Bubb Rubb,"[0, 0]","Too thick, no flexibility. Sounds really harsh and like it is ruining my ukulele strings. Tried on bass too, again with less than satisactory results.",0.0,These are just awful,1396828800,"04 7, 2014"
A1FCX548TD6DLP,B003QTM9O2,Cooper the Beagle,"[0, 0]","At the time I bought, was $16.  Mine arrived broken, so it had gone back.  Reality is that it is not that good regardless of mine being broken.  Not upset about that - stuff happens.  It is just not a good stand.  Light construcion, unstable (topples easily) and a likely candidate to be broken if dropped.  The 'protective' materails on the stand to keep product from scratching your instrument are the soft, shiny runner like materail and it 'sticks' to my instrument's neck.  So I pick up uke and I get a stand until the stickiness is seprated by gravity.  Happened every time.  Yes, I tried out the stand even though broken, and it proved to be a bad choice.  Back it has gone.  5 stars to Amazon's return policy, thouh!",0.0,"Poorly Made, Flimsy.  Buy Another Product",1389225600,"01 9, 2014"
AZCP5P3BARLS5,B003VWJ2K8,"Da Bean ""Da Bean""","[2, 2]","There is a problem with the design.  When you move the head, the 3 little plastic pieces that hold the ball that allows you to rotate the head, just break off.  The tuner itself is great, but the product fails because it broke in 5 minutes.",0.0,Broke!,1397606400,"04 16, 2014"
A15TYOEWBQYF0X,B003VWJ2K8,"David W ""Dave""","[1, 1]","For some reason, this one just doesn't hit the notes right.  It looks like it should tune more precise than other models but the tone is way off for mine anyway.  I have tried it several times and it just doesn't tune right.  Then I recheck with my other brand and it's not even close.  Maybe I just got a bad one?  I like that this one shuts off automatically..but again, it's WAY off tune.I did like the style, size and color.....but it doesn't work right so it's like running with a flat tire...",0.0,I have another brand that works so much easier and works better,1389830400,"01 16, 2014"
A3G6P4SJ8SYH9F,B003VWJ2K8,Donald,"[1, 1]",I ordered this from the Amazon warehouse as a refurbished item. It was properly packaged but the base was broken and poorly glued together. The glue didn't  hold so the clamping base separated from the stem that allows the meter to swivel. This was unfixable so I sent it back for a refund. Warehouse deals are not such good deals.,0.0,Might have been a good one.,1383091200,"10 30, 2013"
A2RVY2GDMZHH4,B003VWJ2K8,puddytat,"[0, 1]",Very accurate tuner BUT it broke within the first week I used it.  The little head on the tuner is connected with an arm and a ball and even when  you are gently the three prongs holding the ball joint can crack and break rendering it useless.  I will try to get a replacement... Now as a tuner it was really quite good but just not durable which is kinda what you need.,0.0,Works great if it doesn't break,1328054400,"02 1, 2012"
AYTKUTAP0VA53,B003VWJ2K8,Yakov Hadash,"[2, 2]","Like the other one star reviewers -- my problem is that the head broke off. I tried to glue it back on, but it just fell apart even worse when I tried to do that. If you buy this, you really need to baby it! My advice is look for a more sturdy model!",0.0,Broken head,1388534400,"01 1, 2014"
A30HTJ530SMRB7,B003W47NII,Carlo,"[2, 4]","...what is the sound in the background of the hissssssssssssss? My guitar I guess, but who cares? I honestly bought this gizmo for the extremely good hisssssssssssssing nothing else.A question to AMAZON: Companies producing objects that are nothing else than a lemon shouldn't be prosecuted?P.S.I think it is ""too polluting"" for 'low cost' items to waste again in paper box, transportation, restocking work, refund work and so on. This is why 99% of the time I do not ask for my money back / BUT / sell this lemon on Amazon, online with other websites,  and in all the instrument shops worldwide in a total bad faith (while testing nobody in iRig noticed the overwhelming  hisssssssing?) well that is beyond me!",0.0,I will finally hear a great hisssss in my earphone!,1324944000,"12 27, 2011"
A2OPSPL8LSSJPC,B0042F1L4S,Jared Jennings,"[5, 30]","My review(s) for this have changed a few times, but no more. When I first got it I liked the sound, though it did sound a little cold and digital, and this is from someone wanting to record shoegaze/dreampop, which by it's nature is full of cold tones (reverb/chorus/delay) shimmering, a la cocteau twins, chapterhouse, lush, so at first I thought it was great. Then the fuse software was even cooler, all this customizing the sound, though it did sound noisy and needed the compressor to take some of the noise away.After all of that I finally realized I was trying to ignore the fizz/crackle/hair, it's called a few things. Go to the fender forums and look it up, or search it on yahoo/google.The thing happening with this amp I think is a few things. Fender guitars sound best through it, which is silly if you don't own a fender, and I don't and refuse to get a squire as that body is so played out, I wanted ANYTHING but a strat body, unless I have a grand to pay for an older one, I'm not going to get a rinky dink one, and I would only get one after I got like 5 other dream guitars first.so everyone has different problems with pickup quality and guitar quality. Also, playing into a modeling amp is like playing into a computer, that may be fine for some (younger folks), but to a lot of people I've read the complaints I was trying not to realize, as I didn't feel like having to pay for shipping to return it, BUT I DID!And I am so glad I did. I almost got a peavey vypyr, and I am glad I didn't. This amp, to be fair, is really close to being really cool, but that sound problem, which I read on fender's own forum/website, FENDER ACKNOWLEDGES IT EXISTS, BUT DOES NOTHING TO FIX IT IN FUTURE MODELS!! sorry, but that's some big company b.s.I've been reading of people saying it sounds cold and lifeless and all that and tube this and tube that, and I was like ""what music snobs"" and what have you. But I realized that I'm a music snob! I love the music I listen to more than anything, and feel like the music I create should have a life to it as well. So I returned the mustang 2 and ALMOST got a marshall mg 30 watt, cause I wanted an amp with a clean sound that didn't have that crackle sound, but THANKFULLY I caught myself before that return, as after that, it would have been final.The decision I did make I think will be great for me, as I'd rather start with a good real tone, then get the effects I need. I kept reading reviews of these teenagers that hadn't played for more than a year or two or so saying ""throw away your pedals, you won't need them"" and ""I was going to get pedals, but don't need to now"", that's kind of the danger of these amps, they end up making everyone sound the same! No matter what tweaking I was doing on the mustang, it sounded the same but in a different costume.I think this amp and modeling amps are best for beginning guitarists and I've seen some old timers getting an amp for home use after years, maybe that's for them, but I needed something to record with and practice and get the best, most real tone possible, so that means tube amp.I think if I played this at a GC I wouldn't of gotten it, and I just tried to make myself like it.",0.0,"this amp is oooookay , fizzle/crackle, and noise when you aren't playing",1327363200,"01 24, 2012"
A10044ECXDUVKS,B00466HM28,Dean J Copely,"[2, 4]",Works as advertised but the keys are stiff. Pads take too much presure to activate. Nice that I dont need another interface to connect it to my laptop.After the first few uses the USB socket broke and fell off into the unit rendering it useless. Wrote to dealer that was listed as selling it to me thru Amazon only to have them tell me the wrong seller was listed. I had registered it with AKAI already so I complained to them and they sent me a new one. I had to pay shipping back the old one to them even though it was a defective product.Not recommending this product.,0.0,OK for the price and USB connection without interface needed,1345161600,"08 17, 2012"
A278CZM7C2OO8A,B00466HM28,Jim Dandy,"[0, 5]",This unit might be great if you have child hands - The KEYS ON THE  keyboard is soooo small..  Don't get this if you have Man hands! wtf U[DATE THE DESCRIPTION Akai WTF,0.0,What a joke,1389830400,"01 16, 2014"
A3CNFMV0IISC3C,B004FEGXDK,Brian F.,"[2, 17]","A dull, inept version of a TubeScreamer. Just sounds flat and boring. Not very inspiring. At all. (Then again, I never did really like TS's).......",0.0,Dull,1352332800,"11 8, 2012"
AXMYGK3WC8BPP,B004FEGXDK,"C. Forbes ""Just a guy with an open mind""","[0, 0]","Really wanted to like this one, because I loved the price. There is no way this is true bypass. The one I got was defective out of the box, and so when I checked, I saw the circuitry did not support pass through.  Maybe it is because I received a defective one, but I still wouldn't try this brand name. I am now stuck saving up for a Full Tone or something.",0.0,"Not true bypass, colors tone/breaks easily.",1403740800,"06 26, 2014"
A3HKZSCGFU9T2A,B004FPEF84,Teagan Mago,"[1, 1]","I honestly don't see the purpose.  It doesn't seem to have improved my experience with my strings on my guitar.  I've used it a few times, but don't see the benefit.Edit 5/30/13:After coming back to read the other reviews, it's obvious what happened:  This was shipped to me completely dry.  There was no grease/lubricant qualities.  It was like a dry erase pad.  They need to improve their quality control.  I'm changing my rating from 3 star to 1 star.  They HAVE to find a way to fully secure this gap or maybe consider enhanced vacuum sealing packaging.I would suggest if you receive this product and it hasn't dried out yet, to place this product in a air-tight ziplock bag to reduce the likelihood of this drying out.",0.0,It seems pretty unnecessary,1361923200,"02 27, 2013"
A2Y1R8CZMTALJP,B004HJ9COU,BigSteph66,"[0, 0]","The cable arrived on time and the it looked nice for ten minutes. I don""t like how the tips screw on and off and the fabric shielding slid out of place the first time I used it. The cable worked well for about two weeks but then it lost current in the middle of a session and I lost sound. This cable is complete garbage. Never again!",0.0,Waste of Money,1344384000,"08 8, 2012"
A1F4KCBVDP8S25,B004ISK48S,Adam,"[6, 10]","I purchased this amp locally and initially, I thought it was pretty cool as it was my first modeling amp; lots of potential for a limitless variety of sounds. This was my first Fender amp as well.The presets were neat and all, but when I played around with some of the ""standard"" models (just the amp model, no effects) just to see how it's clean sound was, the amp just hissed as if I had the volume cranked with a distortion pedal engaged at max. The master volume was at 2 and no effects were turned on... I've never heard a clean channel with so much noise behind it, even when there was no guitar plugged in... All I could hear while playing was the underlying hiss coming through the notes; very distracting and it drove me nuts! This isn't a ground loop issue (my other amps sound just fine at bedroom volumes and beyond), it's clearly a defect with this product. Dirty pre-sets with lots of gain and extra volume sound even worse, again, even when nothing is plugged in and at low master volume. You'd think I was running a few super high gain stomp boxes with a red hot single coil, but NOTHING was plugged in and all I get is staticy-hiss at LOW LEVELS. WTF?The next issue is the weird ""fizz"" sound, that was especially noticeable on the low e. After striking a string, instead of a clean note, there's a weird fizzy digital artifact like sound that ""surrounds"" the note, and fades as the string stops moving. It almost sounds like cymbals crashing on a poorly authored MP3 file at a low bit rate and frequency. Whole chords break down and decay in this fizzy envelope and really makes this thing unplayable.The weird thing is, neither one of these problems arose with head phones plugged in, or when this was connected to my computed via either USB or the line in... but I'm not going to be stuck playing a 100 watt amp through my PC or cans. I got the III instead of the II because of the power behind it and the touted 12"" Celestion speaker.Read the many reviews online or forum posts on many of the guitar/amp related websites (there's a 65 page forum post on the Fender support site that is quite interesting) and you'll find that these amps are having issues. Apparently, the Mustang I and II don't have these issues, and the firmware update did NOTHING to correct my amp. Is this a hardware issue, software issue, speaker issue? There is speculation that the LCD screen (which is not present on the I or II) may be causing problems, but no one seems to know for sure and Fender doesn't seem to care...Definitely try this before you buy it. You may get an amp that doesn't have these problems, you may not notice the sounds or you may not even care; let your ears tell you what sounds good.This amp has a lot of potential for great sounds, and it would have been nice to have faithful modeling of some great vintage amps, but in my opinion, technical issues have made this amp sound like complete garbage. I am disappointed that Fender hasn't yet correct what ever is wrong (some folks claim that Fender reps say that know what is wrong, but I'm not taking that as a fact...), but they have acknowledged that there is ""something"" wrong.Whatever... I took this back after a few days of playing with it, trying to eliminate the junk sounds without success( the built-in noise gate helps a little, but sucks tone) and I picked up a 100 watt Marshall instead. Guess what? The clean channel has ZERO hum or buzz, even when cranked. How about that? Even when I engage a dirt box on one of the dirty channels, there is minimal noise.I'll knock Fender for NOT correcting this issue regardless of what it is and what caused it, but they do have some other nice amps that I'd like to try. But before I buy another Fender amp, I'll take it for a test drive and I suggest you do the same before picking up one of these turds.",0.0,Fizz and noise issues,1328400000,"02 5, 2012"
A2MHK6C40Z54TB,B004N0MKN8,Rob M.,"[0, 0]","A great idea, but pure crap in terms of functionality.  if you don't have something heavy on the flat end, the rubber piece moves, and before you know it, your axe is on the ground.  I saw some pictures of putting a 12 ounce can on the flat part as a counterweight, but I'm not so hot with that idea, especially if the can is open.  The lip need to extend down longer, and *something* needs to be done on the bottom of the flat portion to stop this gadget from moving around.  If I had a permanent place to mount this, I'd gorilla glue it down, but that then defeats the beauty of this being mobile and I'll get an extra guitar stand instead.  Good idea, but it doesn't work.",0.0,"Good idea in theory, but I'm tired of my guitar falling over.",1384905600,"11 20, 2013"
A1B3CNORXB1USI,B004OU2IQG,kay bhee,"[17, 65]","allotoday went to the stores to TEST out the followingtascams...dr 05,  dr 07 mk2, and dr 40  and, for myself,ended up buying nothing...their differences for YOUR  ears...are....dr 05,  this is a good quality toy...NO line in...use its own mic, you will be ok  with this, for meetings, etc.NOT really that good for  music...can be done, but NOT as good..if you use ext mic...u wont be happy either...HIGH background HISS noise  relative to all 3.dr 07etc etc...only slightly better than 05...all else same...dr 40 was MUCH quieter in noise level...be it...in mic, ext mic or LINE inquite decent but costs you around 200 dollars...this can be used to ( semi ) record music too.so, testing on their own mics...that last one was far far better than the first two...for those wantingLINE in...means only that dr 40...however,my tests involved  checking  sound QUALITY  of bit more seriousLIVE recordings...took output from our  zoom r 24 recorder  and  input that to the dr 40...upon comparing the resulting  CDs...a / mstr ed by the zoom r24 and print to cd,  vs...b / recorded dr40 and printed to cd...the sound was Obviously better  with  a /no need to buy  any  a/d recorder attempt at this price level ,if one is looking for semi serious  Master recorder...my budget must be tripled at least...and then to go out to test some more !no cheap way, is there....for those curious, the whole idea has come from wanting to connect  2 units of zoom r24,  NOT wanting to use computer software,  taking the 4 outputs from these two into a clean mixer or analog sum box,  and getting them downto  2 channels, and finallly to some mastering digital recorder....hoping perhaps the tascam ss r100 or r200 MIGHT do the trick,in the tests to come....many thanks, and may your camels always have two humps !k",0.0,so so for  conversation recording...only non serious use.,1351123200,"10 25, 2012"
A1VQHH85U7PX0,B004T6M7DE,"MyBeesWax ""A Music Fan""","[1, 2]","Right out of the box, the low E string had a buzz and the intonation was WAY off (fretted E note on the 12th fret too sharp). After the appropriate truss rod adjustments the buzz problem was solved. Next, I proceeded to adjust the intonation. I was able to get the intonation for the A, D, G, B, and high-E strings spot on. However, after bringing the saddle for the low E string as far back as it would go, the fretted E note on the 12th fret was still sharp.I also noticed that the bridge is slightly crooked (the low E string end of the bridge is closer to the neck than the high E string end of the bridge) - the bridge could have started out crooked or it could have shifted due to the high low-E string tension (loose bridge) -- which would definitely contribute to the defective low-E string intonation.I love the Red Burst design of this guitar (it looks absolutely WICKED). Unfortunately, I'm going to have to return it. I'm going to get a Squier Strat instead (with either aMapleorRosewoodneck).---[Update November 15, 2013]I ordered the Squier Strat direct from Amazon 6 weeks ago, but it was placed on backorder. I contacted Customer Service a week ago and was told me they wouldn't get it back in stock until December. Then, to my surprise, the Squier Strat was delivered yesterday! Yay!! :D The happiness!!I was able to get the Squier perfectly intonated. It's Red Burst like the Legacy (Fender calls it Antique Burst). It's a beautful guitar and and I'm loving it!",0.0,Crooked Bridge Causes Defective Low E String Intonation,1380844800,"10 4, 2013"
A16Z3HTUIYPDH8,B004TE5HBU,Reviewer,"[5, 38]","Just use a smartphone to record stuff. This is a really weird, not very intuitive little device that has been antiquated by the iphone and other smart phones. Not really worth the $75 - I returned mine.",0.0,Use a smartphone,1363132800,"03 13, 2013"
A3621QMU492VV4,B004TQJ174,Ray Mond,"[0, 2]","Well... it's not really too expensive, but it give you basically the same sound no matter how you set it.  Even the crunch button is just a louder sound?  Not a very good value unless you try it out first and this is exactly the sound you're looking for.  Guess that's why it's so cheap.",0.0,Can't Dunlop come up with a better descriptive word then b***** ?,1390780800,"01 27, 2014"
AVP5CCREISHVX,B004U1QDL0,Raul Diaz Pea,"[3, 4]",This product is bad quality because the noise it makes. It increases the volume so much that it is better not to use it at all. I'm going to sell this product. I didn't like it.,0.0,A lot a noise when using rate different from 50%,1394323200,"03 9, 2014"
A165EMA3YTIM6A,B004UJO41S,Beach Panda,"[1, 11]","DOWNGRADE TO 1-O STAR AFTER RETURNING IT BACK TO BROOKMAYS, THE SELLER:I am really disappointed by the seller, BrookMays', ignorant responses to my return of the defective Cherbub Guitar Pickup, which picks up unwanted noise by the wire's own movements and the high frequency of feedback that other pickup won't have the same issue.  After two weeks of the returned item was delivered, I didn't hear anything from the seller regarding the return, so I emailed to the seller to see if we can settle it asap.  Too bad, four days after the email had been sent, I only got the email of telling me the case# of the message I sent without any further response to my refund.  until my patience is gone to deal with this hassle, and I don't think it's worth to waste more time on it, despite the fact of wasting the time and money I spent on this useless pickup and the shipping costs. Therefore, yesterday, I emailed my last contact to the seller regarding the refund of the purchase and gonna report this to AMAZON about the bad after-sale service I ever have before if I still haven't heard from the seller shorty.Today, I finally received the seller's response to my refund, the seller denies the issues of the pickup and claims, ""it was not defective. All pickups are going to get unwanted noise if you move the guitar. The feedback can be to to many other issues. I have issued the refund of $7.04.""  Obviously, the reply is unconvincing; although the feedback can be raised from varies issues, i have tried with another pickup to the same directions and setups, but it doesn't have such problems at all.  The fact is NOT ALL pickups get UNWANTED noise although I didn't try many pickups.  Cherub Guitar Pickup doesn't work as the product description to pickup the original tones of the instrument regardless the surrounding noises.  Moreover, the unwanted loud noise from its wire movements is really annoying, and there's no way to stop the wire movements while strumming. Indeed, I won't use it, and I don't want it to sit at my house as a useless property, so returning back to the seller may help to improve the issues it has.  However, the hassles I got from the seller is totally unexpected and it's NOT worth at all.By the way, I'm also unhappy about the refund of &7.04, I bought it for $8.79 along with AMAZON Free Shipping of the purchase of $25 or more.  To me, it is not the money of $1.75, but it's not fair to the buyer, who doesn't get the right service and quality from the purchase but only wastes the times and money on this matter. So if you really need a pickup for your instrument, I highly recommend you to spend few more dollars to get a much better and reliable one. Don't make the same mistake as I did to try this one because of the cheap price, in turn, you may get more hassles than you expect on such cheap merchandise.  I don't want that happens to anyone else, so I decided to tell you what I went through to keep you from the possible hassles before betting on it.2 STARS FOR THE 1ST REVIEW AFTER USING IT TWICE:I like the clip-on design, which is easy to use, so it is worth 2 stars; however, it doesn't work well clipping on small soundholed string instruments like ukes and kid size guitars because it touches the strings.  Besides that, it also picks up loudly through the wire's own movements, not as the description ""regardless the surrounding noises.""  I have distressed from those unwanted loud noises.  One more thing that it somehow produces much higher feedback to the mini amp that I use, and I have to turn the volume as low as possible to prevent the high frequency of feedback. However, when I switch to another pickup with the same setup on mini amp and acoustic guitars or uke. the amp doesn't have any feedback even turning it to almost the highest volume, and the other pickup doesn't have the unwanted noise from its own movement either.  I don't know whether is my lack of luck or the poor pickup I got ... I bought it because its cheap price (less than $9) & clip-on design, but, I can't accept the noises and I have to waste my shipping cost to return it back to the seller. So, if you want to give it a try, you may bear in mind that the seller, BrookMays, doesn't take any responsibility for the shipments even the item doesn't work properly as claimed description. Good Luck then!",0.0,Picks up UNWANTED NOISE & BAD AFTER-SALE SERV,1325548800,"01 3, 2012"
